{
  "schema": "hermes.raw-source/v2",
  "schema_version": 2,
  "source_id": "src_sha256_0123456789abcdef0123456789abcdef0123456789abcdef0123456789abcdef",
  "source_type": "article",
  "source_url": "https://example.invalid/source",
  "retrieved_at": "2026-08-11T03:16:00Z",
  "content_sha256": "sha256:0123456789abcdef0123456789abcdef0123456789abcdef0123456789abcdef",
  "title": "Example",
  "author": null,
  "published_at": null,
  "trace_id": "trace_01ARZ3NDEKTSV4RRFFQ69G5FAY",
  "task_id": "task_01ARZ3NDEKTSV4RRFFQ69G5FAV",
  "immutable": true,
  "security_flags": []
}
